MySQL Assignment -2 (DML)


Q1. Write a SQL statement to insert a record as follows:
Employees :
+-------------+-------------+-------------+----------+--------------------+------------+------------+----------+----------------+------------+---------------+
| EMPLOYEE_ID | FIRST_NAME | LAST_NAME | EMAIL | PHONE_NUMBER |HIRE_DATE | JOB_ID | SALARY | COMMISSION_PCT | MANAGER_ID |DEPARTMENT_ID |
+-------------+-------------+-------------+----------+--------------------+------------+------------+----------+----------------+------------+---------------+
| 100 | Steven | King | SKING | 515.123.4567 |1987-06-17 | AD_PRES | 24000.00 | 0.00 | 200 |10 |

| 101 | Neena | Kochhar | NKOCHHAR | 515.123.4568 |1987-06-18 | AD_VP | 17000.00 | 0.00 | 200 |10 |

| 102 | Lex | De Haan | LDEHAAN | 515.123.4569 |1987-06-19 | AD_VP | 17000.00 | 0.00 | 200 |10 |

| 103 | Alexander | Hunold | AHUNOLD | 590.423.4567 |1987-06-20 | IT_PROG | 9000.00 | 0.00 | 103 |60 |

| 104 | Bruce | Ernst | BERNST | 590.423.4568 |1987-06-21 | IT_PROG | 6000.00 | 0.00 | 103 |60 |

| 105 | David | Austin | DAUSTIN | 590.423.4569 |1987-06-22 | IT_PROG | 4800.00 | 0.00 | 103|60 |

| 106 | Valli | Pataballa | VPATABAL | 590.423.4560 |1987-06-23 | IT_PROG | 4800.00 | 0.00 | 103 |60 |

| 107 | Diana | Lorentz | DLORENTZ | 590.423.5567 |1987-06-24 | IT_PROG | 4200.00 | 0.00 | 114 |30 |

| 108 | Nancy | Greenberg | NGREENBE | 515.124.4569 |1987-06-25 | SA_MAN | 12000.00 | 0.00 | 145 |80 |

| 109 | Daniel | Faviet | DFAVIET | 515.124.4169 |1987-06-26 | SA_MAN | 9000.00 | 0.00 | 145 |80 |


mysql> table employee;
Empty set (0.02 sec)

mysql> desc employee;
+---------------+--------------+------+-----+---------+-------+
| Field         | Type         | Null | Key | Default | Extra |
+---------------+--------------+------+-----+---------+-------+
| employee_id   | int          | YES  | UNI | NULL    |       |
| first_name    | varchar(20)  | YES  |     | NULL    |       |
| last_name     | varchar(20)  | YES  |     | NULL    |       |
| email         | varchar(20)  | YES  |     | NULL    |       |
| phone_number  | int          | YES  |     | NULL    |       |
| hire_date     | date         | YES  |     | NULL    |       |
| job_id        | int          | YES  |     | NULL    |       |
| salary        | decimal(7,2) | YES  |     | NULL    |       |
| commision     | decimal(7,2) | YES  |     | NULL    |       |
| manager_id    | decimal(6,0) | YES  |     | NULL    |       |
| department_id | decimal(4,0) | YES  | MUL | NULL    |       |
+---------------+--------------+------+-----+---------+-------+
11 rows in set (0.00 sec)

mysql> alter table employee modify column job_id varchar(20);
Query OK, 0 rows affected (0.14 sec)
Records: 0  Duplicates: 0  Warnings: 0

mysql> desc employee;
+---------------+--------------+------+-----+---------+-------+
| Field         | Type         | Null | Key | Default | Extra |
+---------------+--------------+------+-----+---------+-------+
| employee_id   | int          | YES  | UNI | NULL    |       |
| first_name    | varchar(20)  | YES  |     | NULL    |       |
| last_name     | varchar(20)  | YES  |     | NULL    |       |
| email         | varchar(20)  | YES  |     | NULL    |       |
| phone_number  | int          | YES  |     | NULL    |       |
| hire_date     | date         | YES  |     | NULL    |       |
| job_id        | varchar(20)  | YES  |     | NULL    |       |
| salary        | decimal(7,2) | YES  |     | NULL    |       |
| commision     | decimal(7,2) | YES  |     | NULL    |       |
| manager_id    | decimal(6,0) | YES  |     | NULL    |       |
| department_id | decimal(4,0) | YES  | MUL | NULL    |       |
+---------------+--------------+------+-----+---------+-------+
11 rows in set (0.02 sec)


mysql> alter table employee modify column phone_number varchar(20);
Query OK, 0 rows affected (0.12 sec)
Records: 0  Duplicates: 0  Warnings: 0


mysql> desc department;
+-----------------+--------------+------+-----+---------+-------+
| Field           | Type         | Null | Key | Default | Extra |
+-----------------+--------------+------+-----+---------+-------+
| department_id   | decimal(4,0) | NO   | PRI | 0       |       |
| department_name | varchar(30)  | NO   |     | NULL    |       |
| manager_id      | decimal(6,0) | NO   | PRI | 0       |       |
| location_id     | decimal(4,0) | YES  |     | NULL    |       |
+-----------------+--------------+------+-----+---------+-------+
4 rows in set (0.00 sec)

mysql> insert into department(department_id, department_name, manager_id, location_id)
    -> values
    -> (10, "Administration", 200, 1700),
    -> (20, "Marketing", 201, 1800),
    -> (30, "Purchasing", 114, 1700),
    -> (40, "Human Resources", 203, 2400),
    -> (50, "Shipping", 121, 1500),
    -> (60, "IT", 103, 1400),
    -> (70, "Public Relations", 204, 2700),
    -> (80, "Sales", 145, 2500);
Query OK, 8 rows affected (0.03 sec)
Records: 8  Duplicates: 0  Warnings: 0

mysql> table department;
+---------------+------------------+------------+-------------+
| department_id | department_name  | manager_id | location_id |
+---------------+------------------+------------+-------------+
|            10 | Administration   |        200 |        1700 |
|            20 | Marketing        |        201 |        1800 |
|            30 | Purchasing       |        114 |        1700 |
|            40 | Human Resources  |        203 |        2400 |
|            50 | Shipping         |        121 |        1500 |
|            60 | IT               |        103 |        1400 |
|            70 | Public Relations |        204 |        2700 |
|            80 | Sales            |        145 |        2500 |
+---------------+------------------+------------+-------------+
8 rows in set (0.00 sec)

mysql> insert into employee
    -> (employee_id, first_name, last_name, email, phone_number, hire_date,
    ->  job_id, salary, commision, manager_id, department_id)
    -> values
    -> (100, 'Steven',   'King',      'SKING',    '515.123.4567', '1987-06-17', 'AD_PRES', 24000.00, 0.00, 200, 10),
    -> (101, 'Neena',    'Kochhar',   'NKOCHHAR', '515.123.4568', '1987-06-18', 'AD_VP',   17000.00, 0.00, 200, 10),
    -> (102, 'Lex',      'De Haan',   'LDEHAAN',  '515.123.4569', '1987-06-19', 'AD_VP',   17000.00, 0.00, 200, 10),
    -> (103, 'Alexander','Hunold',    'AHUNOLD',  '590.423.4567', '1987-06-20', 'IT_PROG',  9000.00, 0.00, 103, 60),
    -> (104, 'Bruce',    'Ernst',     'BERNST',   '590.423.4568', '1987-06-21', 'IT_PROG',  6000.00, 0.00, 103, 60),
    -> (105, 'David',    'Austin',    'DAUSTIN',  '590.423.4569', '1987-06-22', 'IT_PROG',  4800.00, 0.00, 103, 60),
    -> (106, 'Valli',    'Pataballa', 'VPATABAL', '590.423.4560', '1987-06-23', 'IT_PROG',  4800.00, 0.00, 103, 60),
    -> (107, 'Diana',    'Lorentz',   'DLORENTZ', '590.423.5567', '1987-06-24', 'IT_PROG',  4200.00, 0.00, 114, 30),
    -> (108, 'Nancy',    'Greenberg', 'NGREENBE', '515.124.4569', '1987-06-25', 'SA_MAN', 12000.00, 0.00, 145, 80),
    -> (109, 'Daniel',   'Faviet',    'DFAVIET',  '515.124.4169', '1987-06-26', 'SA_MAN',  9000.00, 0.00, 145, 80);
Query OK, 10 rows affected (0.03 sec)
Records: 10  Duplicates: 0  Warnings: 0

mysql> table employee;
+-------------+------------+-----------+----------+--------------+------------+---------+----------+-----------+------------+---------------+
| employee_id | first_name | last_name | email    | phone_number | hire_date  | job_id  | salary   | commision | manager_id | department_id |
+-------------+------------+-----------+----------+--------------+------------+---------+----------+-----------+------------+---------------+
|         100 | Steven     | King      | SKING    | 515.123.4567 | 1987-06-17 | AD_PRES | 24000.00 |      0.00 |        200 |            10 |
|         101 | Neena      | Kochhar   | NKOCHHAR | 515.123.4568 | 1987-06-18 | AD_VP   | 17000.00 |      0.00 |        200 |            10 |
|         102 | Lex        | De Haan   | LDEHAAN  | 515.123.4569 | 1987-06-19 | AD_VP   | 17000.00 |      0.00 |        200 |            10 |
|         103 | Alexander  | Hunold    | AHUNOLD  | 590.423.4567 | 1987-06-20 | IT_PROG |  9000.00 |      0.00 |        103 |            60 |
|         104 | Bruce      | Ernst     | BERNST   | 590.423.4568 | 1987-06-21 | IT_PROG |  6000.00 |      0.00 |        103 |            60 |
|         105 | David      | Austin    | DAUSTIN  | 590.423.4569 | 1987-06-22 | IT_PROG |  4800.00 |      0.00 |        103 |            60 |
|         106 | Valli      | Pataballa | VPATABAL | 590.423.4560 | 1987-06-23 | IT_PROG |  4800.00 |      0.00 |        103 |            60 |
|         107 | Diana      | Lorentz   | DLORENTZ | 590.423.5567 | 1987-06-24 | IT_PROG |  4200.00 |      0.00 |        114 |            30 |
|         108 | Nancy      | Greenberg | NGREENBE | 515.124.4569 | 1987-06-25 | SA_MAN  | 12000.00 |      0.00 |        145 |            80 |
|         109 | Daniel     | Faviet    | DFAVIET  | 515.124.4169 | 1987-06-26 | SA_MAN  |  9000.00 |      0.00 |        145 |            80 |
+-------------+------------+-----------+----------+--------------+------------+---------+----------+-----------+------------+---------------+
10 rows in set (0.00 sec)


Q2.  Write a SQL statement to insert 3 rows by a single insert statement.


mysql> insert into employee
    -> (employee_id, first_name, last_name, email, phone_number, hire_date,
    ->  job_id, salary, commision, manager_id, department_id)
    -> values
    -> (110, 'Amit',  'Sharma',  'ASHARMA', '987.654.3210', '1987-06-27', 'IT_PROG', 7000, 0.00, 103, 60),
    -> (111, 'Neha',  'Patil',  'NPATIL',  '987.654.3211', '1987-06-28', 'SA_REP',  8000, 0.00, 114, 30),
    -> (112, 'Rahul', 'Verma',  'RVERMA',  '987.654.3212', '1987-06-29', 'HR_REP',  6000, 0.00, 200, 10);
Query OK, 3 rows affected (0.01 sec)
Records: 3  Duplicates: 0  Warnings: 0

mysql> table employee;
+-------------+------------+-----------+----------+--------------+------------+---------+----------+-----------+------------+---------------+
| employee_id | first_name | last_name | email    | phone_number | hire_date  | job_id  | salary   | commision | manager_id | department_id |
+-------------+------------+-----------+----------+--------------+------------+---------+----------+-----------+------------+---------------+
|         100 | Steven     | King      | SKING    | 515.123.4567 | 1987-06-17 | AD_PRES | 24000.00 |      0.00 |        200 |            10 |
|         101 | Neena      | Kochhar   | NKOCHHAR | 515.123.4568 | 1987-06-18 | AD_VP   | 17000.00 |      0.00 |        200 |            10 |
|         102 | Lex        | De Haan   | LDEHAAN  | 515.123.4569 | 1987-06-19 | AD_VP   | 17000.00 |      0.00 |        200 |            10 |
|         103 | Alexander  | Hunold    | AHUNOLD  | 590.423.4567 | 1987-06-20 | IT_PROG |  9000.00 |      0.00 |        103 |            60 |
|         104 | Bruce      | Ernst     | BERNST   | 590.423.4568 | 1987-06-21 | IT_PROG |  6000.00 |      0.00 |        103 |            60 |
|         105 | David      | Austin    | DAUSTIN  | 590.423.4569 | 1987-06-22 | IT_PROG |  4800.00 |      0.00 |        103 |            60 |
|         106 | Valli      | Pataballa | VPATABAL | 590.423.4560 | 1987-06-23 | IT_PROG |  4800.00 |      0.00 |        103 |            60 |
|         107 | Diana      | Lorentz   | DLORENTZ | 590.423.5567 | 1987-06-24 | IT_PROG |  4200.00 |      0.00 |        114 |            30 |
|         108 | Nancy      | Greenberg | NGREENBE | 515.124.4569 | 1987-06-25 | SA_MAN  | 12000.00 |      0.00 |        145 |            80 |
|         109 | Daniel     | Faviet    | DFAVIET  | 515.124.4169 | 1987-06-26 | SA_MAN  |  9000.00 |      0.00 |        145 |            80 |
|         110 | Amit       | Sharma    | ASHARMA  | 987.654.3210 | 1987-06-27 | IT_PROG |  7000.00 |      0.00 |        103 |            60 |
|         111 | Neha       | Patil     | NPATIL   | 987.654.3211 | 1987-06-28 | SA_REP  |  8000.00 |      0.00 |        114 |            30 |
|         112 | Rahul      | Verma     | RVERMA   | 987.654.3212 | 1987-06-29 | HR_REP  |  6000.00 |      0.00 |        200 |            10 |
+-------------+------------+-----------+----------+--------------+------------+---------+----------+-----------+------------+---------------+
13 rows in set (0.00 sec)


Q3.   Write a SQL statement to insert one row in jobs table to ensure that no duplicate
      value will be entered in the job_id column.

mysql> desc jobs;
+------------+--------------+------+-----+---------+-------+
| Field      | Type         | Null | Key | Default | Extra |
+------------+--------------+------+-----+---------+-------+
| job_id     | int          | NO   | PRI | NULL    |       |
| job_title  | varchar(20)  | YES  |     |         |       |
| min_salary | decimal(7,2) | YES  |     | 8000.00 |       |
| max_salary | decimal(7,2) | YES  |     | NULL    |       |
+------------+--------------+------+-----+---------+-------+
4 rows in set (0.00 sec)


mysql> alter table jobs modify column job_id varchar(20);
Query OK, 0 rows affected (0.10 sec)
Records: 0  Duplicates: 0  Warnings: 0

mysql> desc jobs;
+------------+--------------+------+-----+---------+-------+
| Field      | Type         | Null | Key | Default | Extra |
+------------+--------------+------+-----+---------+-------+
| job_id     | varchar(20)  | NO   | PRI | NULL    |       |
| job_title  | varchar(20)  | YES  |     |         |       |
| min_salary | decimal(7,2) | YES  |     | 8000.00 |       |
| max_salary | decimal(7,2) | YES  |     | NULL    |       |
+------------+--------------+------+-----+---------+-------+
4 rows in set (0.00 sec)


mysql> insert into jobs(job_id, job_title, min_salary, max_salary)
    -> values
    -> ("AD_PRES", "President", 20000, 40000),
    -> ("AD_VP", "Administration Vice President", 15000, 30000),
    -> ("AD_ASST", "Administration Assistant", 3000, 6000),
    -> ("FI_MG", "Finance Manager", 8200, 16000),
    -> ("FI_ACCOUNT", "Accountant", 4200, 9000),
    -> ("AC_MGR", "Accounting Manager", 8200, 16000),
    -> ("AC_ACCOUNT", "Public Accountant", 4200, 9000),
    -> ("SA_MAN", "Sales Manager", 10000, 20000);
ERROR 3819 (HY000): Check constraint 'jobs_chk_1' is violated.


mysql> show create table jobs;
+-------+-----------------------------------------------------------------------------------------------------------------------------------------------------------------------------------------------------------------------------------------------------------------------------------------------------------------------------------------------+
| Table | Create Table                                                                                                                                                                                                                                                                                                                                  |
+-------+-----------------------------------------------------------------------------------------------------------------------------------------------------------------------------------------------------------------------------------------------------------------------------------------------------------------------------------------------+
| jobs  | CREATE TABLE `jobs` (
  `job_id` varchar(20) NOT NULL,
  `job_title` varchar(20) DEFAULT ' ',
  `min_salary` decimal(7,2) DEFAULT '8000.00',
  `max_salary` decimal(7,2) DEFAULT NULL,
  PRIMARY KEY (`job_id`),
  CONSTRAINT `jobs_chk_1` CHECK ((`max_salary` <= 25000))
) ENGINE=InnoDB DEFAULT CHARSET=utf8mb4 COLLATE=utf8mb4_0900_ai_ci |
+-------+-----------------------------------------------------------------------------------------------------------------------------------------------------------------------------------------------------------------------------------------------------------------------------------------------------------------------------------------------+
1 row in set (0.00 sec)

mysql> alter table jobs drop constraint jobs_chk_1;
Query OK, 0 rows affected (0.03 sec)
Records: 0  Duplicates: 0  Warnings: 0


mysql> insert into jobs(job_id, job_title, min_salary, max_salary)
    ->     values
    ->     ("AD_PRES", "President", 20000, 40000),
    ->     ("AD_VP", "Administration Vice President", 15000, 30000),
    ->     ("AD_ASST", "Administration Assistant", 3000, 6000),
    ->     ("FI_MG", "Finance Manager", 8200, 16000),
    ->     ("FI_ACCOUNT", "Accountant", 4200, 9000),
    ->     ("AC_MGR", "Accounting Manager", 8200, 16000),
    ->     ("AC_ACCOUNT", "Public Accountant", 4200, 9000),
    ->     ("SA_MAN", "Sales Manager", 10000, 20000);
Query OK, 8 rows affected (0.00 sec)
Records: 8  Duplicates: 0  Warnings: 0

mysql> table jobs;
+------------+-------------------------------+------------+------------+
| job_id     | job_title                     | min_salary | max_salary |
+------------+-------------------------------+------------+------------+
| AC_ACCOUNT | Public Accountant             |    4200.00 |    9000.00 |
| AC_MGR     | Accounting Manager            |    8200.00 |   16000.00 |
| AD_ASST    | Administration Assistant      |    3000.00 |    6000.00 |
| AD_PRES    | President                     |   20000.00 |   40000.00 |
| AD_VP      | Administration Vice President |   15000.00 |   30000.00 |
| FI_ACCOUNT | Accountant                    |    4200.00 |    9000.00 |
| FI_MG      | Finance Manager               |    8200.00 |   16000.00 |
| SA_MAN     | Sales Manager                 |   10000.00 |   20000.00 |
+------------+-------------------------------+------------+------------+
8 rows in set (0.00 sec)

Q3. 

mysql> insert into jobs(job_id, job_title, min_salary, max_salary)
    -> values
    -> ("IT_TEST", "Software Tester", 9000, 16000);
Query OK, 1 row affected (0.03 sec)

mysql> table jobs;
+------------+-------------------------------+------------+------------+
| job_id     | job_title                     | min_salary | max_salary |
+------------+-------------------------------+------------+------------+
| AC_ACCOUNT | Public Accountant             |    4200.00 |    9000.00 |
| AC_MGR     | Accounting Manager            |    8200.00 |   16000.00 |
| AD_ASST    | Administration Assistant      |    3000.00 |    6000.00 |
| AD_PRES    | President                     |   20000.00 |   40000.00 |
| AD_VP      | Administration Vice President |   15000.00 |   30000.00 |
| FI_ACCOUNT | Accountant                    |    4200.00 |    9000.00 |
| FI_MG      | Finance Manager               |    8200.00 |   16000.00 |
| IT_TEST    | Software Tester               |    9000.00 |   16000.00 |
| SA_MAN     | Sales Manager                 |   10000.00 |   20000.00 |
+------------+-------------------------------+------------+------------+
9 rows in set (0.00 sec)


Q4.  Write SQL statement to increment salary of each emp by 10%.


mysql> update employee set salary = salary + salary * 0.10;
Query OK, 13 rows affected (0.03 sec)
Rows matched: 13  Changed: 13  Warnings: 0

mysql> table employee;
+-------------+------------+-----------+----------+--------------+------------+---------+----------+-----------+------------+---------------+
| employee_id | first_name | last_name | email    | phone_number | hire_date  | job_id  | salary   | commision | manager_id | department_id |
+-------------+------------+-----------+----------+--------------+------------+---------+----------+-----------+------------+---------------+
|         100 | Steven     | King      | SKING    | 515.123.4567 | 1987-06-17 | AD_PRES | 26400.00 |      0.00 |        200 |            10 |
|         101 | Neena      | Kochhar   | NKOCHHAR | 515.123.4568 | 1987-06-18 | AD_VP   | 18700.00 |      0.00 |        200 |            10 |
|         102 | Lex        | De Haan   | LDEHAAN  | 515.123.4569 | 1987-06-19 | AD_VP   | 18700.00 |      0.00 |        200 |            10 |
|         103 | Alexander  | Hunold    | AHUNOLD  | 590.423.4567 | 1987-06-20 | IT_PROG |  9900.00 |      0.00 |        103 |            60 |
|         104 | Bruce      | Ernst     | BERNST   | 590.423.4568 | 1987-06-21 | IT_PROG |  6600.00 |      0.00 |        103 |            60 |
|         105 | David      | Austin    | DAUSTIN  | 590.423.4569 | 1987-06-22 | IT_PROG |  5280.00 |      0.00 |        103 |            60 |
|         106 | Valli      | Pataballa | VPATABAL | 590.423.4560 | 1987-06-23 | IT_PROG |  5280.00 |      0.00 |        103 |            60 |
|         107 | Diana      | Lorentz   | DLORENTZ | 590.423.5567 | 1987-06-24 | IT_PROG |  4620.00 |      0.00 |        114 |            30 |
|         108 | Nancy      | Greenberg | NGREENBE | 515.124.4569 | 1987-06-25 | SA_MAN  | 13200.00 |      0.00 |        145 |            80 |
|         109 | Daniel     | Faviet    | DFAVIET  | 515.124.4169 | 1987-06-26 | SA_MAN  |  9900.00 |      0.00 |        145 |            80 |
|         110 | Amit       | Sharma    | ASHARMA  | 987.654.3210 | 1987-06-27 | IT_PROG |  7700.00 |      0.00 |        103 |            60 |
|         111 | Neha       | Patil     | NPATIL   | 987.654.3211 | 1987-06-28 | SA_REP  |  8800.00 |      0.00 |        114 |            30 |
|         112 | Rahul      | Verma     | RVERMA   | 987.654.3212 | 1987-06-29 | HR_REP  |  6600.00 |      0.00 |        200 |            10 |
+-------------+------------+-----------+----------+--------------+------------+---------+----------+-----------+------------+---------------+
13 rows in set (0.00 sec)


Q5.  Write a SQL statement to change the email column of employees table with 'not
     available' for those employees whose department_id is 80 and gets a
     commission is less than .20%


mysql> update employee
    -> set email = "not available"
    -> where department_id = 80 and commision < 0.20;
Query OK, 2 rows affected (0.01 sec)
Rows matched: 2  Changed: 2  Warnings: 0

mysql> table employee;
+-------------+------------+-----------+---------------+--------------+------------+---------+----------+-----------+------------+---------------+
| employee_id | first_name | last_name | email         | phone_number | hire_date  | job_id  | salary   | commision | manager_id | department_id |
+-------------+------------+-----------+---------------+--------------+------------+---------+----------+-----------+------------+---------------+
|         100 | Steven     | King      | SKING         | 515.123.4567 | 1987-06-17 | AD_PRES | 26400.00 |      0.00 |        200 |            10 |
|         101 | Neena      | Kochhar   | NKOCHHAR      | 515.123.4568 | 1987-06-18 | AD_VP   | 18700.00 |      0.00 |        200 |            10 |
|         102 | Lex        | De Haan   | LDEHAAN       | 515.123.4569 | 1987-06-19 | AD_VP   | 18700.00 |      0.00 |        200 |            10 |
|         103 | Alexander  | Hunold    | AHUNOLD       | 590.423.4567 | 1987-06-20 | IT_PROG |  9900.00 |      0.00 |        103 |            60 |
|         104 | Bruce      | Ernst     | BERNST        | 590.423.4568 | 1987-06-21 | IT_PROG |  6600.00 |      0.00 |        103 |            60 |
|         105 | David      | Austin    | DAUSTIN       | 590.423.4569 | 1987-06-22 | IT_PROG |  5280.00 |      0.00 |        103 |            60 |
|         106 | Valli      | Pataballa | VPATABAL      | 590.423.4560 | 1987-06-23 | IT_PROG |  5280.00 |      0.00 |        103 |            60 |
|         107 | Diana      | Lorentz   | DLORENTZ      | 590.423.5567 | 1987-06-24 | IT_PROG |  4620.00 |      0.00 |        114 |            30 |
|         108 | Nancy      | Greenberg | not available | 515.124.4569 | 1987-06-25 | SA_MAN  | 13200.00 |      0.00 |        145 |            80 |
|         109 | Daniel     | Faviet    | not available | 515.124.4169 | 1987-06-26 | SA_MAN  |  9900.00 |      0.00 |        145 |            80 |
|         110 | Amit       | Sharma    | ASHARMA       | 987.654.3210 | 1987-06-27 | IT_PROG |  7700.00 |      0.00 |        103 |            60 |
|         111 | Neha       | Patil     | NPATIL        | 987.654.3211 | 1987-06-28 | SA_REP  |  8800.00 |      0.00 |        114 |            30 |
|         112 | Rahul      | Verma     | RVERMA        | 987.654.3212 | 1987-06-29 | HR_REP  |  6600.00 |      0.00 |        200 |            10 |
+-------------+------------+-----------+---------------+--------------+------------+---------+----------+-----------+------------+---------------+
13 rows in set (0.00 sec)


Q6.  Write a SQL statement to change the email column of employees table with 'not
     available' for those employees who belongs to the 'Purchasing' department.

mysql> update employee set email = 'not available' where department_id IN(select department_id from department where department_name = "Purchasing");
Query OK, 3 rows affected (0.03 sec)
Rows matched: 3  Changed: 3  Warnings: 0

mysql> table employee;

+-------------+------------+-----------+---------------+--------------+------------+----------------+----------+-----------+------------+---------------+
| employee_id | first_name | last_name | email         | phone_number | hire_date  | job_id         | salary   | commision | manager_id | department_id |
+-------------+------------+-----------+---------------+--------------+------------+----------------+----------+-----------+------------+---------------+
|         100 | Steven     | King      | SKING         | 515.123.4567 | 1987-06-17 | AD_PRES        | 26400.00 |      0.00 |        200 |            10 |
|         101 | Neena      | Kochhar   | NKOCHHAR      | 515.123.4568 | 1987-06-18 | AD_VP          | 18700.00 |      0.00 |        200 |            10 |
|         102 | Lex        | De Haan   | LDEHAAN       | 515.123.4569 | 1987-06-19 | AD_VP          | 18700.00 |      0.00 |        200 |            10 |
|         103 | Alexander  | Hunold    | AHUNOLD       | 590.423.4567 | 1987-06-20 | IT_PROG        |  9900.00 |      0.00 |        103 |            60 |
|         104 | Bruce      | Ernst     | BERNST        | 590.423.4568 | 1987-06-21 | IT_PROG        |  6600.00 |      0.00 |        103 |            60 |
|         105 | David      | Austin    | DAUSTIN       | 590.423.4569 | 1987-06-22 | IT_PROG        |  5280.00 |      0.00 |        103 |            60 |
|         106 | Valli      | Pataballa | VPATABAL      | 590.423.4560 | 1987-06-23 | IT_PROG        |  5280.00 |      0.00 |        103 |            60 |
|         107 | Diana      | Lorentz   | not available | 590.423.5567 | 1987-06-24 | IT_PROG        |  4620.00 |      0.00 |        114 |            30 |
|         108 | Nancy      | Greenberg | not available | 515.124.4569 | 1987-06-25 | SA_MAN         | 13200.00 |      0.00 |        145 |            80 |
|         109 | Daniel     | Faviet    | not available | 515.124.4169 | 1987-06-26 | SA_MAN         |  9900.00 |      0.00 |        145 |            80 |
|         110 | Amit       | Sharma    | ASHARMA       | 987.654.3210 | 1987-06-27 | IT_PROG        |  7700.00 |      0.00 |        103 |            60 |
|         111 | Neha       | Patil     | not available | 987.654.3211 | 1987-06-28 | SA_REP         |  8800.00 |      0.00 |        114 |            30 |
|         112 | Rahul      | Verma     | RVERMA        | 987.654.3212 | 1987-06-29 | HR_REP         |  6600.00 |      0.00 |        200 |            10 |
|         113 | Sara       | Smith     | NULL          | NULL         | 2021-03-10 | Shipping Clerk |  9000.00 |      NULL |       NULL |           100 |
|         114 | David      | Brown     | not available | NULL         | 2020-08-25 | Programmer     | 12000.00 |      NULL |       NULL |            30 |
+-------------+------------+-----------+---------------+--------------+------------+----------------+----------+-----------+------------+---------------+
15 rows in set (0.00 sec)



Q7.  Write a SQL statement to change the email and commission_pct column of
     employees table with 'not available' and 0.10 for all employees.

mysql> update employee set email = 'not available' , commision = 0.10;
Query OK, 15 rows affected (0.03 sec)
Rows matched: 15  Changed: 15  Warnings: 0

mysql> table employee;
+-------------+------------+-----------+---------------+--------------+------------+----------------+----------+-----------+------------+---------------+
| employee_id | first_name | last_name | email         | phone_number | hire_date  | job_id         | salary   | commision | manager_id | department_id |
+-------------+------------+-----------+---------------+--------------+------------+----------------+----------+-----------+------------+---------------+
|         100 | Steven     | King      | not available | 515.123.4567 | 1987-06-17 | AD_PRES        | 26400.00 |      0.10 |        200 |            10 |
|         101 | Neena      | Kochhar   | not available | 515.123.4568 | 1987-06-18 | AD_VP          | 18700.00 |      0.10 |        200 |            10 |
|         102 | Lex        | De Haan   | not available | 515.123.4569 | 1987-06-19 | AD_VP          | 18700.00 |      0.10 |        200 |            10 |
|         103 | Alexander  | Hunold    | not available | 590.423.4567 | 1987-06-20 | IT_PROG        |  9900.00 |      0.10 |        103 |            60 |
|         104 | Bruce      | Ernst     | not available | 590.423.4568 | 1987-06-21 | IT_PROG        |  6600.00 |      0.10 |        103 |            60 |
|         105 | David      | Austin    | not available | 590.423.4569 | 1987-06-22 | IT_PROG        |  5280.00 |      0.10 |        103 |            60 |
|         106 | Valli      | Pataballa | not available | 590.423.4560 | 1987-06-23 | IT_PROG        |  5280.00 |      0.10 |        103 |            60 |
|         107 | Diana      | Lorentz   | not available | 590.423.5567 | 1987-06-24 | IT_PROG        |  4620.00 |      0.10 |        114 |            30 |
|         108 | Nancy      | Greenberg | not available | 515.124.4569 | 1987-06-25 | SA_MAN         | 13200.00 |      0.10 |        145 |            80 |
|         109 | Daniel     | Faviet    | not available | 515.124.4169 | 1987-06-26 | SA_MAN         |  9900.00 |      0.10 |        145 |            80 |
|         110 | Amit       | Sharma    | not available | 987.654.3210 | 1987-06-27 | IT_PROG        |  7700.00 |      0.10 |        103 |            60 |
|         111 | Neha       | Patil     | not available | 987.654.3211 | 1987-06-28 | SA_REP         |  8800.00 |      0.10 |        114 |            30 |
|         112 | Rahul      | Verma     | not available | 987.654.3212 | 1987-06-29 | HR_REP         |  6600.00 |      0.10 |        200 |            10 |
|         113 | Sara       | Smith     | not available | NULL         | 2021-03-10 | Shipping Clerk |  9000.00 |      0.10 |       NULL |           100 |
|         114 | David      | Brown     | not available | NULL         | 2020-08-25 | Programmer     | 12000.00 |      0.10 |       NULL |            30 |
+-------------+------------+-----------+---------------+--------------+------------+----------------+----------+-----------+------------+---------------+
15 rows in set (0.00 sec)

mysql>
